{
  "name": "Default",
  "description": "The default theme for Harmonicon.",
  "default_menu_button": {
    "description": "Used if the inner definition of a button lacks a value",
    "background_image": {
      "image_file": "images/button_background.png",
      "description": "Default background image for Buttons"
    },
    "icon": {
      "image_file": "images/play_button.png",
      "description": "Default icon for Buttons"
    },
    "button_shaders": {
      "hover": "shaders/button_hover.wgsl",
      "click": "shaders/button_click.wgsl",
      "idle": "shaders/button_idle.wgsl"
    },
    "button_sounds": {
      "hover": "sounds/button_hover.ogg",
      "click": "sounds/button_click.ogg"
    },
    "coords": {
      "x": 510,
      "y": 0,
      "width": 260,
      "height": 50
    }
  },
  "default_background": {
    "image": "images/default_background.png",
    "description": "Default background image for the application"
  },
  "menus": {
    "Main": {
      "background_image": "images/main_background.png",
      "buttons": [
        { "id": "Play",    "coords": { "x": 410, "y": 260, "width": 260, "height": 50 } },
        { "id": "Options", "coords": { "x": 510, "y": 326, "width": 260, "height": 50 } },
        { "id": "Credits", "coords": { "x": 610, "y": 392, "width": 260, "height": 50 } },
        { "id": "SongEditor", "coords": { "x": 710, "y": 458, "width": 260, "height": 50 } },
        { "id": "Quit",    "coords": { "x": 810, "y": 522, "width": 260, "height": 50 } }
      ]
    },
    "Play": {
      "background_image": "images/play_background.png",
      "buttons": [
        { "id": "PlaySong",   "coords": { "x": 510, "y": 290, "width": 260, "height": 50 } },
        { "id": "JamSession", "coords": { "x": 510, "y": 356, "width": 260, "height": 50 } },
        { "id": "BackToMain", "coords": { "x": 510, "y": 422, "width": 260, "height": 50 } }
      ]
    },
    "ArtistList": {
      "buttons": [
        { "id": "BackToPlay", "coords": { "x": 510, "y": 620, "width": 260, "height": 50 } }
      ]
    },
    "SongList": {
      "buttons": [
        { "id": "BackToArtistList", "coords": { "x": 510, "y": 620, "width": 260, "height": 50 } }
      ]
    },
    "ModeSelect": {
      "buttons": [
        { "id": "PlayMode2D", "coords": { "x": 510, "y": 290, "width": 260, "height": 50 } },
        { "id": "PlayMode3D", "coords": { "x": 510, "y": 356, "width": 260, "height": 50 } },
        { "id": "BackToPlay", "coords": { "x": 510, "y": 422, "width": 260, "height": 50 } }
      ]
    },
    "Options": {
      "buttons": [
        { "id": "Theme",      "coords": { "x": 510, "y": 490, "width": 260, "height": 50 } },
        { "id": "Calibrate",  "coords": { "x": 510, "y": 556, "width": 260, "height": 50 } },
        { "id": "BackToMain", "coords": { "x": 510, "y": 622, "width": 260, "height": 50 } }
      ]
    },
    "Theme": {
      "buttons": [
        { "id": "BackToOptions", "coords": { "x": 510, "y": 640, "width": 260, "height": 50 } }
      ]
    },
    "Calibration": {
      "buttons": [
        { "id": "Cancel", "coords": { "x": 510, "y": 640, "width": 260, "height": 50 } }
      ]
    },
    "Credits": {
      "background_image": "images/credits_background.png"
    }
  },
  "colors": {
    "song_editor": {
      "editor_bg": "#0F0F17",
      "hole_box": "#282838",
      "lane_a": "#1F1F2B",
      "lane_b": "#1A1A24",
      "grid_line": "#333345",
      "bar_line": "#666685",
      "half_line": "#2B2B3B",
      "quarter_line": "#21212E",
      "accent": "#F2CC59",
      "label": "#BFC0D1",
      "panel_bg": "#1A1A26",
      "btn_bg": "#29293D",
      "btn_active": "#476B4C",
      "field_bg": "#1A1A24",
      "field_bg_focus": "#29293D",
      "ghost_ok": "#FAD933",
      "ghost_bad": "#E64033"
    }
  }
}
